{"$schema":"https://json-schema.org/draft/2020-12/schema","title":"Katalog-AI Record","type":"object","additionalProperties":false,"required":["id","cat","desc","tags","url","ver"],"properties":{"id":{"type":"string","minLength":1},"cat":{"type":"string","minLength":1},"desc":{"type":"string","minLength":1},"tags":{"type":"array","items":{"type":"string"}},"url":{"type":"string"},"ver":{"type":"object","additionalProperties":false,"required":["d","s"],"properties":{"d":{"type":"string","pattern":"^\\d{4}-\\d{2}-\\d{2}$"},"s":{"type":"integer","minimum":0}}}}}
