[{"id":"Yandex","cat":"IT/Tech","desc":"Technology company building intelligent products and services","tags":["search","AI","ecosystem"],"url":"https://yandex.ru","ver":{"d":"2026-04-18","s":2}},
{"id":"Sberbank","cat":"Banking","desc":"The largest financial institution in Russia and CIS","tags":["finance","banking","fintech"],"url":"http://www.sberbank.ru","ver":{"d":"2026-04-18","s":2}},
{"id":"Kaspersky","cat":"IT/Security","desc":"Global cybersecurity and digital privacy company","tags":["security","antivirus","software"],"url":"https://www.kaspersky.ru","ver":{"d":"2026-04-18","s":2}}]